{
  "project": "agent-cli",
  "branchName": "feat/acp",
  "description": "A test project for agent-cli",
  "userStories": [
    {
      "id": "US-060",
      "title": "Install @agentclientprotocol/sdk and create ACP client module",
      "description": "Add the ACP TypeScript SDK as a dependency and create a new src/core/acp-client.ts module that wraps the ClientSideConnection class. This module handles the ACP lifecycle: launch agent subprocess, initialize protocol handshake, create session, send prompts, and receive structured updates. Reference: https://agentclientprotocol.com/libraries/typescript",
      "acceptanceCriteria": [
        "npm install @agentclientprotocol/sdk succeeds",
        "New src/core/acp-client.ts with ACPClient class",
        "ACPClient.launch() starts an agent subprocess and performs ACP handshake (Initialize + NewSession)",
        "ACPClient.sendPrompt(sessionId, prompt) sends a prompt and returns structured SessionUpdate events",
        "ACPClient.close() gracefully shuts down the session and process",
        "Module is exportable but NOT wired into the main loop yet (standalone module)",
        "npm run build passes"
      ],
      "priority": 1,
      "passes": true,
      "notes": "ACP SDK provides ClientSideConnection for the client side (agent-cli) and AgentSideConnection for agents. We need ClientSideConnection. The SDK handles JSON-RPC 2.0 over stdio transport. Reference: Compozy uses github.com/coder/acp-go-sdk v0.6.3 in Go — we use the TypeScript equivalent."
    },
    {
      "id": "US-061",
      "title": "Implement ACP session lifecycle with structured update handling",
      "description": "Build the full session lifecycle on top of the ACP client: create session with working directory, send prompt as ContentBlock, subscribe to SessionUpdate notifications, parse structured content (text blocks, tool calls with start/update/completed/failed states, diffs, terminal output), detect session completion and idle states, handle errors with structured context.",
      "acceptanceCriteria": [
        "Session creation accepts cwd and optional MCP servers config",
        "Prompts sent as acp.TextBlock content blocks",
        "SessionUpdate handler parses all content types: text, tool_use (start/update/completed/failed), diff, terminal_output",
        "Tool call events include tool_call_id, tool name, and structured input/output",
        "Diff events include old_text, new_text, and file path",
        "Idle detection: session state transitions (working -> idle -> waiting_for_tool) are tracked",
        "Session completion is detected from protocol (not string scanning)",
        "Error handling uses structured ACP error codes, not process exit codes",
        "All events emitted to the event bus (US-046 dependency) for journaling and UI",
        "npm run build passes"
      ],
      "priority": 1,
      "passes": true,
      "notes": "This replaces the current stream-json parsing in tool-runner.ts. ACP provides native structured updates instead of us parsing Claude-specific stream-json format. Compozy reference: internal/core/agent/client.go lines 400-600 (sessionUpdate handler with content block parsing).",
      "dependsOn": [
        "US-060"
      ]
    },
    {
      "id": "US-062",
      "title": "Multi-agent support via ACP provider registry",
      "description": "Replace the current hardcoded tool registry (claude, openclaude) with an ACP provider registry. Each provider specifies: agent name, ACP adapter command (e.g. npx @agentclientprotocol/claude-agent-acp for Claude, npx @zed-industries/codex-acp for Codex), supported capabilities, and default MCP servers. Users can add new agents without code changes via config.",
      "acceptanceCriteria": [
        "New src/core/acp-registry.ts with ACPProviderRegistry",
        "Built-in providers: Claude (@agentclientprotocol/claude-agent-acp), Codex (@zed-industries/codex-acp), Copilot (@github/copilot --acp), Gemini (@google/gemini-cli --acp)",
        "Each provider has: name, command, args, capabilities (fs, terminal), default env vars",
        "Configurable via .agent-cli/providers.json or similar — users can add custom providers",
        "CLI --tool flag maps to provider name (e.g. --tool codex)",
        "Provider availability check (is the adapter installed?)",
        "Fallback: if ACP adapter not found, suggest install command",
        "npm run build passes"
      ],
      "priority": 2,
      "passes": true,
      "notes": "Reference: Compozy internal/core/agent/registry_specs.go has agent specs with Commands, Fallbacks, and EnvVars. ACP adapters are npm packages like @agentclientprotocol/claude-agent-acp. This makes agent-cli agent-agnostic."
    },
    {
      "id": "US-063",
      "title": "MCP server integration per ACP session",
      "description": "ACP natively supports attaching MCP servers to sessions. Implement MCP server configuration per provider/project that gets passed during session creation. This allows agents to use additional tools (databases, APIs, filesystem extensions) beyond their built-in capabilities.",
      "acceptanceCriteria": [
        "Session creation accepts mcpServers config matching ACP's MCP server format",
        "MCP servers configurable per project (in prd.json or separate config)",
        "MCP servers passed to NewSession request via the ACP SDK",
        "Agent can use MCP tools during execution — tool calls appear in structured updates",
        "Support at least: filesystem MCP server, custom tool MCP servers",
        "npm run build passes"
      ],
      "priority": 2,
      "passes": true,
      "notes": "Reference: Compozy passes MCP servers in NewSessionRequest. This is a major advantage over the current approach — agents get extensible tools without modifying agent-cli. MCP server format: { command: string, args: string[], env?: Record<string, string> }.",
      "dependsOn": [
        "US-060"
      ]
    },
    {
      "id": "US-064",
      "title": "Wire ACP client into the main iterator loop",
      "description": "Replace the current tool-runner.ts spawn+stdout approach with the ACP client for structured communication. The iterator creates an ACP session per iteration, sends the prompt as a structured ContentBlock, receives SessionUpdates, and detects completion from the protocol (no more <promise>COMPLETE</promise> string scanning). Keep tool-runner.ts as a legacy fallback for non-ACP tools.",
      "acceptanceCriteria": [
        "Iterator detects if a tool has ACP support (via registry) and uses ACP client instead of tool-runner",
        "ACP path: create session -> send prompt -> stream updates -> detect completion from protocol",
        "Legacy path: existing tool-runner spawn+stdout (unchanged, for tools without ACP)",
        "Story completion detection: instead of scanning stdout for <promise>COMPLETE</promise>, detect from ACP session result or agent's tool call that updates prd.json",
        "Cost and duration extracted from ACP session metadata",
        "Human-readable log still written to .agent-output.log",
        "Monitor TUI shows ACP session updates (tool calls, diffs) in real time",
        "Backward compatible: existing prd.json and workflows continue to work",
        "npm run build passes"
      ],
      "priority": 3,
      "passes": true,
      "notes": "This is the main integration story. The iterator should prefer ACP when available, fall back to legacy spawn+stdout when not. Compozy reference: internal/core/run/executor/runner.go uses ACP client per job execution. The <promise>COMPLETE</promise> signal can be replaced by checking if the agent's final tool call updated prd.json passes field.",
      "dependsOn": [
        "US-060",
        "US-061",
        "US-062"
      ]
    },
    {
      "id": "US-065",
      "title": "ACP session resumption for interrupted runs",
      "description": "ACP supports loading existing sessions (LoadSession). Use this to implement proper session resumption instead of the current --resume which just tracks completed story IDs. When an iteration is interrupted, save the ACP session ID. On resume, load the session and continue from where the agent left off — no lost context, no repeated work.",
      "acceptanceCriteria": [
        "On interruption (SIGINT, crash), save ACP session ID to .session.json",
        "--resume flag loads the ACP session via LoadSession instead of starting a new one",
        "Agent continues with full context from previous run (no prompt replay)",
        "Session timeout handling: if session is expired, start a new one with a summary of what happened",
        "Monitor detects resumed sessions and shows continuation in the UI",
        "npm run build passes"
      ],
      "priority": 3,
      "passes": true,
      "notes": "Major improvement over current resume which just skips completed stories. ACP session resumption preserves the full agent context (conversation, tool state, working memory). Compozy reference: internal/core/agent/client.go LoadSession support.",
      "dependsOn": [
        "US-061",
        "US-064"
      ]
    },
    {
      "id": "US-066",
      "title": "Structured file system boundaries via ACP",
      "description": "ACP provides built-in file system capabilities with path validation. Use ACP's ReadTextFile/WriteTextFile operations instead of granting agents unrestricted filesystem access. Configure allowedRoots per session (project directory + optional add-dirs). All file operations are validated against allowed roots, preventing agents from accessing files outside their sandbox.",
      "acceptanceCriteria": [
        "ACP session initialized with Fs capability (ReadTextFile, WriteTextFile)",
        "allowedRoots set to project directory (+ projectDirectory if different)",
        "Agent file operations are validated by ACP protocol — blocked if outside allowed roots",